ai_method,benefits,date_added,email,organisation,origin,owning_team,scrape_date,source_note,source_url,status,tool_name,usecase
"Natural Language Processing, Machine Learning","Enables residents to live well, independently and safely in their homes. Supports proactive and preventative care through monitoring daily routines and detecting unusual changes. Provides timely support and prevents crises such as falls. Delivers financial benefits to the Council.",28/01/2025,asc.provider@sutton.gov.uk,London Borough of Sutton,gov.uk,People Services and Commissioning Directorates,,"AI-powered care system for independent living, proactive care, and fall prevention in London Borough of Sutton.",https://www.gov.uk/algorithmic-transparency-records/london-borough-of-sutton-access-assure-technology-enabled-care,live,"Access Assure, Technology Enabled Care (TEC)",Health AI
"Machine Learning, Other","30% reduction in missed appointments, £27.5 million estimated annual savings for Mid and South Essex NHS Foundation Trust, 377 DNAs prevented and 1,910 additional patients seen during 6-month pilot",14/03/2024,,NHS England,gov.uk,Deep Medical,,AI software predicts likely missed appointments using algorithms and anonymized data to arrange convenient appointment times.,https://www.england.nhs.uk/2024/03/nhs-ai-expansion-to-help-tackle-missed-appointments-and-improve-waiting-times/,live,Deep Medical AI,Predictive Analytics
"Machine Learning, Natural Language Processing, Computer Vision",Accelerate the testing and evaluation of AI in the NHS to benefit patients with faster and more personalised diagnosis and greater efficiency in screening services.,16/06/2021,,NHS,gov.uk,Department of Health and Social Care,,"£36 million boost for AI technologies in NHS care, 38 new AI projects across various healthcare applications.",https://www.gov.uk/government/news/36-million-boost-for-ai-technologies-to-revolutionise-nhs-care,live,NHS AI Lab AI in Health and Care Award,Health AI
Computer Vision,Detects drivers using mobile phones and not wearing seatbelts to improve road safety and reduce accidents,,info@nationalhighways.co.uk,National Highways,UK,National Highways,,Trial ends March 2025. Uses AI to analyze images of passing motorists for mobile phone use and seatbelt violations.,https://nationalhighways.co.uk/about-us/privacy-notice/mobile-phone-and-seatbelt-detection-trial-ends-march-2025-privacy-notice/,pilot,Mobile Phone and Seatbelt Detection Trial,Vision AI
Not AI,"Increases transparency and public confidence in AI use, provides best practices, ensures ethical and responsible AI adoption",28/03/2024,,Scottish Government,gov.scot,Scottish Government,,Scotland is becoming the first part of the UK to make public sector AI use registration mandatory.,https://www.gov.scot/news/increasing-ai-transparency/,live,Scottish AI Register,Not AI
"Computer Vision, Machine Learning","Automates mapping of peatland surface features across England's uplands using AI, providing comprehensive and repeatable monitoring of peatland damage and restoration. Saves time and resources compared to manual mapping methods.",19/03/2025,anne.williams@naturalengland.org.uk,Natural England,gov.uk,Natural England,,AI4Peat project for mapping peatland features using AI. Outputs to be published as part of England Peat Map in spring 2025.,https://naturalengland.blog.gov.uk/2025/03/19/ai4peat-innovative-use-of-ai-to-map-and-restore-our-precious-peatlands/,pilot,AI4Peat,Vision AI
"Computer Vision, Natural Language Processing, Machine Learning","Provides lessons on designing and implementing real-world evaluations of AI technologies in healthcare settings. Insights cover evaluation scoping, design, implementation, and dissemination of findings.",16/10/2024,,NHS England,NHS England,NHS AI Lab,,Summarizes lessons from evaluations of 13 Phase 4 AI technologies funded through the AI in Health and Care Award (2020-2024).,https://www.england.nhs.uk/long-read/planning-and-implementing-real-world-ai-evaluations-lessons-from-the-ai-in-health-and-care-award/,live,AI in Health and Care Award Evaluations,Health AI
Computer Vision,To assist clinicians in the detection of COVID-19 in chest x-rays,,,University Hospitals of North Midlands NHS Trust,gov.uk,,,Information extracted from FOI response letter dated 30 July 2021,https://www.uhnm.nhs.uk/media/hzvmgtpw/20210730-foi-response-letter-artificial-intelligence-final-ref-173-2122.pdf,live,C-Detect,Health AI
"Large Language Model, generativeAI, Retrieval Augmented Generation","The tool is designed to save teachers time when preparing lessons. The specific benefits are the speed at which Aila can generate full lesson plans, being able to use Oak's corpus of lessons as a starting point, and the ability to ask Aila to personalise the lesson in ways that might normally take a significant amount of time (such as lowering the literacy level, adding or removing content, or changing context to make it more relevant to a school's geographic location.)",17/12/2024,help@thenational.academy,Oak National Academy,gov.uk,Product and Engineering,,AI Lesson Assistant for UK teachers. Uses GPT-4 and Cohere Rerank to generate personalized lesson plans.,https://www.gov.uk/algorithmic-transparency-records/oak-national-academy-aila-oaks-ai-lesson-assistant,pilot,Aila (Oak's AI Lesson Assistant),Other
"Machine Learning, Other","Easing the impact of roadworks for drivers, businesses and local communities through innovative technologies",06/12/2023,,National Highways,cp.catapult.org.uk,National Highways,,Three winners selected for AI-powered roadworks innovation. Trials start January 2024 to improve planning and management.,https://cp.catapult.org.uk/news/national-highways-announces-winners-of-roadworks-innovation-competition/,planned,Roadworks Innovation Competition Winners,Decision Support
Not AI,Improves transparency of AI use across the health and social care sector for patients and staff. Supports safe and ethical adoption of AI technology to improve patient care.,19/09/2024,,Welsh Government,gov.wales,AI Commission for Health and Social Care,,AI Commission endorsed ATRS for health and social care in Wales to improve AI transparency.,https://www.gov.wales/ai-commission-health-and-social-care-endorses-algorithmic-transparency-recording-standard-atrs,live,Algorithmic Transparency Recording Standard (ATRS),Not AI
Machine Learning,"Provides a wider view of EPCs across Wales to support policy development for fuel poverty, energy strategy, and green initiatives",07/05/2025,DataScienceUnit@gov.wales,Welsh Government,wales.gov,"Data Science Unit, Welsh Government",,"Blog post by Joseph HC, Data Science Unit, Welsh Government",https://digitalanddata.blog.gov.wales/2025/05/07/predicting-energy-efficiency-across-all-welsh-homes/,pilot,Energy Efficiency Prediction Model,Predictive Analytics
"Natural Language Processing, Other","The Digital assistant is available 24 hours, 7 days a week, 365 days a year. It contains over 1,500 sample phrases recognising 1000s+ user phrases / questions and has coverege of 60 of HMRC's 120+ taxes. In 2024 (1 Jan - 31 Dec) the DA was accessed 5.48+ million times, representing substantial public savings & freeing up adviser time to handle more complex cases with users. It includes the ability to print and save transcripts of DA and webchat chats so the user can refer back to them at a later time. Any urls given to the user as part of the answer stay active in a saved pdf.",26/06/2025,,HM Revenue & Customs,gov.uk,Chief Digital Product Office,,"HMRC's online chatbot provides 24/7 support, covering 60+ taxes, handling millions of inquiries annually.",https://www.tax.service.gov.uk/ask-hmrc/hmrc-digital-assistant,live,Ask HMRC Online Chatbot Digital Engagement Product (DEP),Conversational AI
"Natural Language Processing, Large Language Model, Retrieval-Augmented Generation","The chatbot provides users with responses quickly by searching across 1000 files in seconds, which would take a human days. It provides an improved user experience by allowing the user to avoid searching and reviewing multiple documents to find their answer. Benefits include accuracy, as the chatbot can accurately recall information of relevance and not miss content. The Current operations team believe that 90% of the frequently asked questions to their human-based team could be answered by the chatbot.",17/12/2024,analysis@digital.cabinet-office.gov.uk,Department for Science Innovation and Technology,gov.uk,Functional Data & Analytics,,Information extracted from the Algorithmic Transparency Record for the Ask Ops Chatbot tool published on GOV.UK,https://www.gov.uk/algorithmic-transparency-records/dsit-ask-ops-chatbot,pilot,Ask Ops Chatbot,Conversational AI
"Large Language Model, Retrieval-Augmented Generation","User research shows that Assist users on average save around 3 hours per week by using the tool. Assist also ensures that outputs automatically adhere to GCS best practice and standards. 98% of users state that Assist is useful in helping them to perform their role. A further benefit of Assist is the upskillling it brings for communicators in their AI capabilities, which will bring further dividends as they utilise AI tools elsewhere in their day-to-day work.",04/06/2025,ai.gcs@cabinetoffice.gov.uk,Cabinet Office,gov.uk,Applied Data and Insight,,Information extracted from the Algorithmic Transparency Record for Cabinet Office: Assist published on GOV.UK,https://www.gov.uk/algorithmic-transparency-records/cabinet-office-assist,live,Assist,Conversational AI
Other,"Efficiency/cost avoidance: automates previously manual processes. Consistency and accuracy: automation is more accurate than humans, with error rate < 0.6% vs ~1% for humans. Speed: can review several million files per year vs 200,000 for human reviewers.",29/02/2024,dkim-cdio@cabinetoffice.gov.uk,Cabinet Office,gov.uk,Digital Knowledge and Information Management Team,,Lexicon-based algorithm using ElasticSearch to automate identification of digital records for retention or disposal.,https://www.gov.uk/algorithmic-transparency-records/cabinet-office-automated-digital-document-review,live,Automated Digital Document Review,Document Intelligence
"Natural Language Processing, Machine Learning","The tool allows the Department to get a quick and immediate overview of the issues being raised by businesses. The tags applied by the tool are available the day after the BI is entered into the CRM software, and can be viewed by anyone in the department.",28/04/2025,ai.governance@businessandtrade.gov.uk,Department for Business and Trade,gov.uk,"Digital, Data and Technology: Data Science Team",,AI tool for tagging business intelligence subjects used by the Department for Business and Trade.,https://www.gov.uk/algorithmic-transparency-records/dbt-business-intelligence-bi-subject-tagger,live,Business Intelligence (BI) Subject Tagger,Document Intelligence
Machine Learning,"Reduced fuel consumption, improved efficiency, lower carbon emissions",,,Birmingham City Council,"Birmingham, UK",Birmingham City Council,,"AI system optimizes waste collection routes for bin lorries, reducing fuel consumption and emissions.",https://www.birmingham.gov.uk/news/article/1243/new_ai_helps_bin_lorries_go_greener,live,AI-powered bin lorries,Other
"Machine Learning, Other","Provides real-time overview of 800 beds, helps staff make quick and informed decisions, anticipates and resolves bottlenecks, reduces patient length of stay, increases A&E efficiency, ensures optimal ward placement, reduces non-emergency surgery cancellations, allows staff to spend more time on care delivery",,communications@bthft.nhs.uk,Bradford Teaching Hospitals NHS Foundation Trust,bradfordhospitals.nhs.uk,Bradford Teaching Hospitals NHS Foundation Trust,,Europe's first hospital command centre using AI at Bradford Royal Infirmary. Improves patient care and hospital efficiency.,https://www.bradfordhospitals.nhs.uk/command-centre/,live,Command Centre,Decision Support
Computer Vision,"Catch undiagnosed spinal fractures, which can be a marker for osteoporosis. Patients will be directed to fracture prevention programmes to reduce future fracture risks.",,,Zebra Medical Vision,england.nhs.uk,Zebra Medical Vision,,Phase 4 winner of the Round 2 AI in Health and Care Awards,https://www.england.nhs.uk/aac/what-we-do/how-can-the-aac-help-me/ai-award/round-2-ai-in-health-and-care-awards/,pilot,Bone Health Solutions,Health AI
Machine Learning,"Helps health professionals identify individuals at risk of unplanned hospital admission in the next year. A successful pilot in Somerset care homes reduced resident falls by 35%, Emergency Department attendances by 60%, and ambulance callouts by 8.7%.",,somicb.enquiries@nhs.net,NHS Somerset,NHS,,,"Brave AI uses ML to identify patients at risk of unplanned hospital admission, being rolled out in SW England.",https://nhssomerset.nhs.uk/about-us/digital-projects/using-artificial-intelligence-to-monitor-wellbeing-brave-ai/,live,Brave AI,Predictive Analytics
"Machine Learning, supervised",Categorises local authorities into groups based on shared factors influencing the cost of waste collection,27/08/2025,,Department for Environment Food and Rural Affairs,gov.uk,"Department for Environment, Food and Rural Affairs",,"Ministerial department, Environmental protection function, Private Beta phase, UK region",https://www.gov.uk/algorithmic-transparency-records,pilot,Local Authority Waste Collection Cost Groupings,Other
Other,"Provides free, accessible financial management support (5-10 minute completion time), offers structured guidance across all financial aspects (income, bills, investments, insurance), supports informed financial decision-making through personalised recommendations, enables users to identify areas for financial improvement, helps prevent financial oversights through comprehensive categorisation, facilitates long-term financial planning through data-driven insights",10/02/2025,atrs.enquiries@maps.org.uk,Money and Pensions Service,gov.uk,Technology and Change,,Information extracted from the GOV.UK Algorithmic Transparency Record for the Money and Pensions Service Budget Planner tool.,https://www.gov.uk/algorithmic-transparency-records/money-and-pensions-service-budget-planner,live,Budget Planner,Decision Support
Other,"CARS(V) improves efficiency in the process of handling applications by determining its likely complexity which can in turn be allocated to the appropriate grade of decision maker or for directive enrichment. By understanding operational complexity, this enables resource and planning to better determine required resources.",17/12/2024,public.enquiries@homeoffice.gov.uk,Home Office,gov.uk,"Central Services team, Cross Cutting Service Operations, Visa, Status and Information Services, UK Visas and Immigration",,CARS(V) is a semi-automated workflow routing solution for identifying complexity of visitor visa applications.,https://www.gov.uk/algorithmic-transparency-records/home-office-complexity-application-routing-solution-visits,live,Complexity Application Routing Solution - Visits (CARS(V)),Workflow Automation
Natural Language Processing,"Improve how AI technologies work in Welsh, contribute open data archives to the research community, improve linguistic performance of AI models and applications in Welsh",25/06/2024,,Welsh Government,wales.gov,Welsh Government,,Welsh Government partners with OpenAI to improve Welsh language capabilities in AI technologies like ChatGPT.,https://www.gov.wales/chatgpt-learns-welsh,pilot,ChatGPT in Welsh,Conversational AI
Other,"Developing AI products to tackle challenges faced by charities and public sector organizations, including cancer risk detection for rescue workers, administrative support for teachers, environmental monitoring, and business growth support",10/02/2025,,Scottish Government,gov.scot,Scottish Government,,The Scottish Government's CivTech programme has awarded up to £9 million to 14 companies developing AI products.,https://www.gov.scot/news/improving-lives-through-ai/,pilot,CivTech 10,Other
"Large Language Model, Natural Language Processing",Providing users with far faster responses and signposting for their written enquiry questions.,17/12/2024,Digital.Services@fcdo.gov.uk,Foreign Commonwealth and Development Office,gov.uk,Consular Services Department,,Tool uses Azure Cognitive Services and OpenAI GPT models to process user queries and provide responses to consular enquiries.,https://www.gov.uk/algorithmic-transparency-records/fcdo-consular-digital-triage-written-enquiries-llm,pilot,Consular Digital Triage - Written Enquiries LLM,Conversational AI
"Large Language Model, Natural Language Processing","The key benefits are improving the consultation process making it more likely for the public's voice to be heard and to influence policy, productivity gains for civil servants and reduced costs (including on consultants). Consult reduces the burden on civil servants to compile and categorise consultation responses, empowering analysts to dive deeper into the data and focus more on in-depth consultation analysis. It makes the consultation process faster, less prone to human error, and potentially increases the number of consultations that can be run. The tool is 400 times cheaper and over 120 times quicker than manual analysis.",14/05/2025,consult@cabinetoffice.gov.uk,Department for Science Innovation and Technology,ai.gov.uk,Incubator for AI,,"DSIT Consult tool: Pre-deployment phase, uses GPT-4o on Azure Open AI for consultation analysis.",https://ai.gov.uk/projects/consult/,pilot,Consult,Document Intelligence
Other,"Reduced manual effort, improved customer experience, increased efficiency, reduced errors",,,Coventry City Council,gov.uk,Adult Social Care,,Project listed in Coventry City Council AI and Automation Programme document,https://edemocracy.coventry.gov.uk/documents/s59295/Appendix%201.pdf,live,Adult Social Care - Financial Assessment Automation,Workflow Automation
Not AI,"Outlines practical steps for the Crown Prosecution Service to achieve its 2025 strategic goals, focusing on people, digital capability, strategic partnerships, casework quality, and public confidence",06/07/2020,,Crown Prosecution Service,gov.uk,Crown Prosecution Service,,"CPS Business Plan 2020-21 outlines goals for Crown Prosecution Service, focusing on CPS 2025 strategy implementation.",https://www.cps.gov.uk/publication/cps-business-plan-2020-21,live,CPS Business Plan 2020-21,Not AI
Large Language Model,"Helps residents find answers to council tax questions more quickly and easily, speeds up response times, frees up staff time for complex queries, improves customer experience",22/04/2025,press@croydon.gov.uk,Croydon Council,news.croydon.gov.uk,Croydon Council,,"AI Assistant trial on council tax pages, based on Microsoft Copilot. Positive testing results, informing wider rollout.",https://news.croydon.gov.uk/ai-assistant-trial-to-help-residents-find-council-tax-information-quicker-and-easier-online/,live,AI Assistant,Conversational AI
Machine Learning,"Provides academic researchers with linked datasets across the Justice system (courts, prisons and probation) where individuals can be identified with a single, universal ID. Enables unprecedented analysis of repeat users of the same services and cross-cutting analysis across multiple services.",17/12/2024,datafirst@justice.gov.uk,Ministry of Justice,gov.uk,Data First,,"Probabilistic data linkage tool for linking Justice system datasets, developed by MoJ's Internal Data Linking team.",https://www.gov.uk/algorithmic-transparency-records/moj-data-first-splink,live,Data First (Splink),Predictive Analytics
Other,"Reduces simple queries from reaching customer service teams, provides a simpler customer journey, saves time for agents to focus on complex queries, improves customer satisfaction, and provides cost savings by reducing contact with outsourced contact centers.",04/04/2025,programme.improvement@education.gov.uk,Department for Education,gov.uk,Programme Improvement,,Virtual assistant using predefined paths for simple queries. Future plans may include AI incorporation.,https://www.gov.uk/algorithmic-transparency-records/dfe-virtual-assistant-for-education-providers-and-learners-davina,live,Virtual Assistant for Education Providers and Learners (Davina),Conversational AI
Machine Learning,"Detects early signs of kidney failure, alerts clinicians to patients at risk of acute kidney injury (AKI), saves nurses up to two hours daily, allows more face-to-face time with patients, enables quicker response to patient deterioration, monitors kidney function, detects kidney failure early, and accelerates patient recovery",27/02/2017,,Royal Free London NHS Foundation Trust,royalfree.nhs.uk,Royal Free London NHS Foundation Trust,,App alerts staff to AKI risk patients. Used by 26+ staff at Royal Free Hospital. Expanding to cover sepsis and organ failure.,https://www.royalfree.nhs.uk/news/new-app-helping-improve-patient-care,live,Streams,Decision Support
"generativeAI, Large Language Model","Supports teachers in planning lessons, building classroom quizzes, and reducing workloads. Helps create individualised content tailored to teaching pupils based on high-quality curriculum content.",30/10/2023,,UK Government,gov.uk,Department for Education,,Press release announcing £2M investment in Oak National Academy AI tools for teachers.,https://www.gov.uk/government/news/new-support-for-teachers-powered-by-artificial-intelligence,pilot,Oak National Academy AI Tools,Document Intelligence
Other,"The tool will identify cases where a further human review is required, without the need for manual intervention. Reports on around 25,000 insolvent companies are currently passed through the rules engine each year and this identifies approximately 8,500 to 9,000 cases for initial investigation. Without the rules engine, significant resource would be required to look at the content of each completed report to assess if there were potential conduct issues.",28/04/2025,DCAS@insolvency.gov.uk,The Insolvency Service,gov.uk,Compliance and Targeting,,"Rules engine processes reports to identify potential conduct issues in insolvency cases, reducing manual review.",https://www.gov.uk/algorithmic-transparency-records/insolvency-service-director-conduct-reporting-service-rules-engine,live,Director Conduct Reporting Service - Rules Engine,Decision Support
Machine Learning,"More accurate predictions of harm, well-defined view of risk being predicted, defined prediction window, known error level, use of more information in risk assessment, feedback mechanisms for model accuracy and officer actions, testing of preventative measures, improved data quality",29/02/2024,VRUTechnicalSupport@thamesvalley.police.uk,Hampshire Constabulary and Thames Valley Police,gov.uk,Thames Valley Violence Reduction Unit Data and Targeting Team,,Information extracted from GOV.UK algorithmic transparency record for DARAT tool,https://www.gov.uk/algorithmic-transparency-records/hampshire-and-thames-valley-police-darat,pilot,DARAT (Domestic Abuse Risk Assessment Tool),Decision Support
"unsupervised, supervised","The primary benefits of the tool is that it produces an estimated dataset that covers a broad range of use cases, where WCC have little to no existing data. It fills a gap in EPC data for around 100,000 homes in Warwickshire, helping to improve outcomes for citizens while covering a broad range of services for Warwickshire Council. It provides substantial value for money compared to manual EPC assessments.",28/01/2025,businessintelligence@warwickshire.gov.uk,Warwickshire County Council,gov.uk,Data Science,,"Tool estimates EPC data for 100k Warwickshire homes, improving council services and citizen outcomes.",https://www.gov.uk/algorithmic-transparency-records/warwickshire-county-council-domestic-epc-estimates,live,Domestic EPC Estimates,Predictive Analytics
Other,"This tool reduces the time taken to conclude cases, improves the aim for cases to meet 100% accuracy, undertakes automatic updates to drivers system records, reduces the process time when compared to the existing casework system. The tool further reduces the risk of data breaches as it reduces the number of manual processes as well as reduces customer address discrepancies held between existing systems. This will improve road safety concerns.",29/05/2025,DMATRS@DVLA.GOV.UK,Driver and Vehicle Licensing Agency,gov.uk,Drivers Medical Group,,Information extracted from the Algorithmic Transparency Record for DVLA's Drivers Medical Casework System,https://www.gov.uk/algorithmic-transparency-records/dvla-drivers-medical-casework-system,pilot,Drivers Medical Casework System,Decision Support
"Large Language Model, Natural Language Processing","Improved efficiency by helping generate quick insights through summarisation and information retrieval, reducing time and effort required. Enhances productivity in routine tasks like drafting and summarisation of documents. Facilitates tasks that may seem unmanageable when performed manually, such as sifting through massive volumes of information across numerous documents.",28/04/2025,redbox-copilot@cabinetoffice.gov.uk,Department for Science Innovation and Technology,gov.uk,Incubator for AI,,AI assistant for UK civil servants using large language models to assist with daily tasks.,https://ai.gov.uk/projects/redbox/,pilot,Redbox,Document Intelligence
