ai_method,benefits,date_added,email,organisation,origin,owning_team,scrape_date,source_note,source_url,status,tool_name,usecase
"Machine Learning, Computer Vision","Reduces radiotherapy planning time by approximately 2.5 times, cuts patient waiting times between referral and treatment, saves doctors between 20 minutes to 3 hours per patient in scan preparation, allows more patients to get treatment sooner, improves likelihood of cure, and frees up clinical time for patient care.",27/06/2023,,Cambridge University Hospitals NHS Foundation Trust,cuh.nhs.uk,Dr Raj Jena's team at Cambridge University Hospitals NHS Foundation Trust and University of Cambridge,,"OSAIRIS is the first cloud-based AI technology to be developed and deployed within the NHS. It works by automating organ segmentation in radiotherapy planning, a task that typically takes doctors between 20 minutes and 3 hours per patient. The technology was developed using open-source software from Microsoft's Project InnerEye and data from patients who had previously been treated at the hospital.",https://www.cuh.nhs.uk/news/ai-cuts-waiting-times-for-cancer-patients-in-nhs-first/,live,OSAIRIS,Health AI
Other,"Provides quick snapshots of national programmes to inform understanding, capturing both forces' and programmes' feedback. Shows how well programmes align with policing's requirements, crucial for the successful development and delivery of digital transformation initiatives.",,,Police Digital Service,magazine.science.police.uk,Police Digital Service (PDS),,"The D&CI initiative was commissioned to run from December 2024 to May 2025. The PoC is evaluating national programmes including Law Enforcement Data Service, International Law Enforcement Alerts Platform, Asset Recovery IT, Digital Case File, Digital Fingerprint Capability and National Firearms Licensing Management Replacement. The project is currently engaging with 18 forces.",https://magazine.science.police.uk/issue-2/update-from-the-police-digital-service/,pilot,Digital and Change Insights (D&CI),Decision Support
"Computer Vision, Machine Learning","Acts as a 'second pair of eyes' during colonoscopy examinations, helping doctors spot small growths (polyps) that could develop into cancer if not found and removed early. The technology watches the live camera feed and alerts doctors to areas of concern, potentially improving early detection rates while adding only 1-2 minutes to regular appointments.",20-Nov-25,,NHS,UK,NICE (National Institute for Health and Care Excellence),,NICE has conditionally recommended this technology for NHS use while more evidence is collected over the next four years to understand its full benefits.,https://www.nice.org.uk/news/articles/new-ai-tools-could-help-save-lives-by-spotting-warning-signs-of-bowel-cancer-earlier,live,CAD EYE,Health AI
"Computer Vision, Machine Learning","The AI tool can spot 95% of cancers according to research. It enables a 'one-day diagnostics' service that could save men up to a month of waiting, reducing weeks of worry and uncertainty. The faster diagnosis pathway could also move care closer to home, with AI-assisted MRI scans potentially being performed in community diagnostic centers. The trial aims to substantially increase the number of patients having suspected cancer diagnosed or ruled out within 28 days, leading to faster treatment and better outcomes for patients and their families. It could also increase capacity for NHS workforce and lead to cost savings.",28/10/2025,,NHS England,england.nhs.uk,Lucida Medical,,"The project is one of 7 innovative pilots backed by a £14 million investment aimed to improve the early detection of cancer, as part of the NHS Cancer Programme Innovation Open Call.",https://www.england.nhs.uk/2025/10/nhs-artificial-intelligence-ai-trial-to-diagnose-prostate-cancer-up-to-a-month-faster/,pilot,Pi,Health AI
"Computer Vision, Machine Learning, Other","RFR helps identify suspects, missing or deceased people, with police conducting over 25,000 facial searches monthly. Notable successes include identifying violent offenders, burglars, and rioters. LFR has led to over 1,300 arrests in London (Jan 2024-Sep 2025) for serious crimes including rape, domestic abuse, and robbery. OIFR has helped identify vulnerable individuals needing assistance, wanted criminals, and those providing false identities.",04/12/2025,psi@nationalarchives.gov.uk,UK Government,gov.uk,Home Office,,"This factsheet from the UK Government provides comprehensive information on police use of facial recognition technology, including types, legal framework, safeguards, and case examples. It notes that 13 police forces were using LFR as of November 2025, and that RFR is widely used across forces. The document addresses concerns about bias and accuracy, with independent testing by the National Physical Laboratory showing 89% accuracy and no significant performance differences based on demographics when used at police settings.",https://www.gov.uk/government/publications/police-use-of-facial-recognition/police-use-of-facial-recognition-factsheet,live,Police Facial Recognition Technology,Vision AI
"Computer Vision, Machine Learning, Other","Enables detection of lung cancer in earliest stages; reaches previously inaccessible lung nodules for biopsy without long delays; uses flexible robotic catheter to navigate deep into lungs; provides faster diagnoses, quicker access to treatment, and improved outcomes while reducing patient anxiety and uncertainty.",17/09/2024,,Manchester University NHS Foundation Trust,NHS,Wythenshawe Hospital,,"Wythenshawe Hospital is one of the first in Europe to adopt the Ion Endoluminal System, building on the success of the Greater Manchester Lung Health Check programme which has diagnosed over 600 early-stage lung cancers.",https://www.england.nhs.uk/north-west/our-work/10-year-health-plan-for-england-fit-for-the-future/analogue-to-digital/,live,Ion Endoluminal System,Health AI
Machine Learning,"Early detection of lung cancer through a simple blood test using machine learning to identify biomarkers. When lung cancer is diagnosed early, patient survival rate increases tenfold. The test aims to detect lung cancer earlier than CT scans, potentially transforming cancer care pathways, reducing anxiety, improving quality of life for high-risk patients, and resulting in substantial financial benefits for the NHS.",16/12/2022,"david.maldonado-perez@nds.ox.ac.uk, d.szulc@oxcan.org",Oxford University Hospitals NHS Foundation Trust,ouh.nhs.uk,"Oxford University Hospitals NHS Foundation Trust, Oxford Radcliffe Biobank, and Oxford Cancer Analytics (OXcan)",,"The study will recruit 200 participants to identify cancer biomarkers in blood samples. It runs until December 2025 and uses machine learning software to analyze protein data in liquid biopsies to identify biomarker signatures indicating early-stage lung cancer. The research addresses the critical need for early detection, as lung cancer is the most common cause of cancer death in the UK (21% of deaths) with over 75% of patients diagnosed at advanced stages.",https://www.ouh.nhs.uk/news/articles/1859/,pilot,Early Lung Cancer Detection Blood Test,Health AI
"Machine Learning, Computer Vision","Quicker and more accurate diagnosis of lung cancer, reduced waiting times, increased efficiency, and freed up staff time. With over 600,000 chest X-rays performed monthly in England, this technology supports clinicians with faster diagnosis.",30/10/2023,,NHS England,gov.uk,Department of Health and Social Care,,£21 million funding allocated to 64 NHS trusts across England for deployment of AI tools that analyze X-rays and CT scans to speed up diagnosis and treatment of lung cancer. The tools are expected to be in place by winter 2023.,https://www.gov.uk/government/news/ai-to-speed-up-lung-cancer-diagnosis-deployed-in-nhs-hospitals,live,AI for Lung Cancer Diagnosis,Health AI
"Large Language Model, Natural Language Processing, Machine Learning","Improved service delivery, streamlined operations, and enhanced decision-making for Stockton Borough Council",,,Stockton Borough Council,stockton.gov.uk,,,Based on user message about Stockton Borough Council's AI strategy; appears to be a discussion about AI implementation in local government,stockton.gov.uk,planned,Stockton Borough Council AI Strategy,Workflow Automation
"Large Language Model, Natural Language Processing","Processed over 50,000 responses to the Independent Water Commission review in 2 hours (costing £240) with higher accuracy than human reviewers (F1 score of 0.79-0.82 vs human agreement F1 of 0.74). Could save 75,000 days of manual analysis annually, worth approximately £20 million in staffing costs.",,press@dsit.gov.uk,UK Government,gov.uk,"Department for Science, Innovation and Technology",,Press release highlighting successful application analyzing Independent Water Commission consultation responses. Tool has also been used for Scottish government consultation on non-surgical cosmetics and the Digital Inclusion Action Plan. Part of the 'Humphrey' suite which includes other tools like 'Redbox'.,https://www.gov.uk/government/news/ground-breaking-use-of-ai-saves-taxpayers-money-and-delivers-greater-government-efficiency,live,Consult,Document Intelligence
"Natural Language Processing, Large Language Model","Saves clinicians 2-3 minutes per consultation. Study across 9 NHS sites showed 23.5% increase in direct patient interaction time, 8.2% reduction in overall appointment length, and 13.4% increase in A&E patients seen per shift.",16/01/2026,,NHS England,england.nhs.uk,NHS England,,"NHS England has published a self-certified registry of 19 AI notetaking suppliers. The technology captures clinician-patient conversations and uses AI to generate real-time transcriptions and clinical summaries. A study led by Great Ormond Street Hospital for Children NHS Foundation Trust's Innovation Unit evaluated over 17,000 patient encounters across hospitals, GP practices, mental health services and ambulance teams.",https://www.england.nhs.uk/2026/01/nhs-backs-ai-notetaking-free-up-more-face-to-face-care/,live,NHS AI notetaking registry,Document Intelligence
Not AI,"The guide helps organizations follow best practices when implementing AI, including: properly assessing user needs and data sources, building the right multidisciplinary team, preparing data appropriately, developing and testing AI models effectively, and ensuring ethical, secure implementation of AI in public services.",13/02/2025,,Centre for Digital Public Services Wales,wales.gov,Centre for Digital Public Services,,"This is a comprehensive guide for public sector organizations in Wales on how to implement AI systems. The guide emphasizes following the Digital Service Standard for Wales, considering Welsh Language requirements, and adhering to the Well-being of Future Generations Act. It structures the implementation process into three phases: Discovery (assessing data, building teams, preparing data), Alpha (building and evaluating models), and Beta (deploying and maintaining models).",https://digitalpublicservices.gov.wales/guidance-and-standards/service-manual/using-artificial-intelligence-public-sector/planning-and-preparing-for-artificial-intelligence-implementation,live,Planning and preparing for artificial intelligence implementation,Not AI
Other,The Commission helps enable the transformation of the NHS for the benefit of patients and drives economic growth in the UK's life sciences sector. It aims to guide the MHRA on how cutting-edge AI technologies can be safely and effectively integrated into everyday healthcare.,26/09/2025,info@mhra.gov.uk,Medicines and Healthcare products Regulatory Agency,gov.uk,Medicines and Healthcare products Regulatory Agency (MHRA),,The Commission reviews current regulations and provides recommendations for a new regulatory framework for AI in healthcare. It addresses urgent areas of uncertainty such as Ambient Voice Technology and supports commitments in the government's 10-Year Health Plan for England and Life Sciences Sector Plan.,https://www.gov.uk/government/groups/national-commission-into-the-regulation-of-ai-in-healthcare,live,National Commission into the Regulation of AI in Healthcare,Health AI
"Machine Learning, Natural Language Processing, Other","Earlier detection of patient safety issues, faster deployment of inspections, reduced manual paperwork for staff, improved patient outcomes, prevention of safety failures before they escalate, and identification of concerning patterns like higher than expected rates of stillbirth, neonatal death and brain injury.",30/06/2025,,NHS England,gov.uk,"Department of Health and Social Care, Care Quality Commission, NHS England",,"The system is part of the UK government's 10 Year Health Plan to transform NHS services from analogue to digital. A maternity outcomes signal system will launch across NHS trusts from November 2025, using near real-time data to flag higher than expected rates of adverse events. The system is built on the NHS Federated Data Platform, which allows healthcare staff to securely access information in one place.",https://www.gov.uk/government/news/world-first-ai-system-to-warn-of-nhs-patient-safety-concerns,planned,NHS AI Patient Safety Early Warning System,Health AI
Other,Bringing together expert technical talent to develop AI applications for public benefit,,i-dot-ai-enquiries@cabinetoffice.gov.uk,Department for Science Innovation and Technology,ai.gov.uk,Department for Science Innovation and Technology,,The Incubator for AI (i.AI) works to pioneer transformative applications of AI for the public good by bringing together expert technical talent.,https://ai.gov.uk/projects/caddy/,live,Incubator for AI (i.AI),Other
"supervised, Machine Learning, Other","Early diagnosis of heart failure which currently affects over 2% of the population and consumes 4% of the NHS budget. Currently, 80% of diagnoses are made during emergency admissions, costing the UK over £2 billion annually. The tool is expected to save £2,400 per patient by potentially eliminating emergency room visits, with projected NHS savings of £100 million through nationwide implementation. Benefits include maximized treatment benefits, improved symptoms, quality of life, and survival rates.",06/08/2024,,NHS England Digital Imperial College London Discover NOW London Secure Data Environment Betsi Cadwaladr Health Board National Institute for Health and Care Research,digital.nhs.uk,"National Heart and Lung Institute, Imperial College London",,"The TRICORDER project uses an AI-powered tool called Eko-DUO to identify patients at risk of heart failure through GP records, revolutionizing heart failure diagnosis and treatment in primary care. It involves over 200 GP practices and has received £1.18 million in funding from the NIHR.",https://digital.nhs.uk/data-and-information/research-powered-by-data/life-saving-research/case-studies/tricorder,pilot,TRICORDER,Health AI
"Other, Machine Learning, generativeAI","Provides a controlled environment to trial AI tools safely, ensure their effectiveness, identify limitations and challenges around the use of AI as a medical device, and explore potential pathways towards regulatory approval. The programme helps accelerate safe AI innovation and supports the Government's vision for the NHS to be the world's most AI-enabled healthcare system.",16/10/2025,newscentre@mhra.gov.uk,Medicines and Healthcare products Regulatory Agency,gov.uk,Medicines and Healthcare products Regulatory Agency (MHRA),,"The AI Airlock programme has selected seven manufacturers developing novel AI-powered healthcare technologies for its second phase. These technologies include tools for reducing bowel cancer test times from weeks to minutes, detecting skin cancer and genetic eye diseases sooner, AI-powered clinical note taking, advanced cancer diagnostics, eye disease detection, hospital stay summaries, and blood test interpretation.",https://www.gov.uk/government/news/ai-tools-that-could-detect-diseases-earlier-selected-for-next-phase-of-mhras-ai-airlock-programme,live,AI Airlock programme,Health AI
Natural Language Processing,"An evolving clinical AI assistant designed to support healthcare professionals by reducing administrative burden and improving quality of care. Today, TORTUS provides automated clinical documentation, integrated directly within electronic health records.",16/10/2025,aiairlock@mhra.gov.uk,MHRA,gov.uk,,,Multi-environment candidate for Regulatory challenge 1: Scope of intended use extension and validation. Testing will run until March 2026.,https://www.gov.uk/government/publications/ai-airlock-phase-2-cohort,pilot,TORTUS,Document Intelligence
"Computer Vision, Natural Language Processing","The new AI centre will help free up officers from desk duties back to the frontline, speed up investigations, reduce bureaucracy, and improve public safety. It will also support catching more criminals quicker through technologies like facial recognition, call transcription for non-emergency reporting, and other AI tools that meet strict standards.",,,Home Office,uk.gov,Home Office with National Police Chiefs' Council (NPCC),,"This initiative involves £115m Home Office funding for a new national AI centre for policing. Police.AI is set to launch in April and will work with forces, public bodies, academia and AI firms to identify, develop and test AI products for policing. The NPCC has created guidance documents including the AI Covenant, Responsible AI Checklist, and Police Problem Book to ensure responsible and transparent AI use.",https://science.police.uk/news-and-events/news/new-115m-ai-centre-for-policing-will-help-catch-more-criminals-quicker/,planned,Police.AI,Security and Monitoring
"Computer Vision, Machine Learning",Delivering More Precise Policing through facial recognition capabilities,,,Metropolitan Police Service,science.police.uk,Office of the Police Chief Scientific Adviser,,Facial recognition technology implementation by the Metropolitan Police Service as part of their policing strategy,https://science.police.uk/categories/artificial-intelligence/,live,Facial Recognition Technology,Security and Monitoring
generativeAI,"Support staff productivity, improve service delivery, and streamline internal processes",11/02/2026,data.protection@barnet.gov.uk,Barnet Council,barnet.gov.uk,Records and Information Management Team,,"Data retained for 30 days (prompts). Council has governance including AI working group, mandatory staff training, and policies for responsible use.",https://www.barnet.gov.uk/digital-barnet/use-artificial-intelligence-ai-barnet-council,live,Microsoft Copilot Web,Conversational AI
Other,"Provides practical 'how-to' knowledge for teams implementing and evaluating AI in health and care, as well as national teams supporting innovation",16/10/2024,,NHS England,england.nhs.uk,NHS England,11/02/2026,This is a guidance document that shares lessons learned from the AI in Health and Care Award about designing and implementing real-world AI evaluations in healthcare settings. The document is intended for teams implementing and evaluating AI technologies as well as national teams supporting innovation.,https://www.england.nhs.uk/publication/planning-and-implementing-real-world-artificial-intelligence-ai-evaluations-lessons-from-the-ai-in-health-and-care-award/,live,Planning and implementing real-world artificial intelligence (AI) evaluations: lessons from the AI in Health and Care Award,Health AI
"generativeAI, Natural Language Processing, Machine Learning",Support for clinical documentation and workflow in health and care settings across England.,27/04/2025,,NHS England,england.nhs.uk,NHS England,11/02/2026,Guidance on implementing AI-enabled ambient scribing products that convert speech into structured medical documentation in NHS settings. The guidance includes an overview for executives and detailed implementation guidance for technical leaders.,https://www.england.nhs.uk/publication/guidance-on-the-use-of-ai-enabled-ambient-scribing-products/,live,AI-enabled ambient scribing products,Health AI
"Machine Learning, Large Language Model, generativeAI, Other","Transforming public services, supporting private sectors to adapt and thrive, boosting productivity, creating high-quality jobs, making Welsh language more accessible in everyday life, enabling faster diagnoses in NHS, personalizing learning in schools, automating processes in local government, and addressing regional inequalities.",,,Welsh Government,wales.gov,Office for AI within Welsh Government,13/02/2026,"The document outlines Wales' strategic approach to AI implementation through four pillars: Economic Growth, Educating Wales, Equitable Delivery, and Excellence & Trust.",https://www.gov.wales/ai-plan-for-wales-html,live,AI Cymru,Decision Support
Not AI,Benefits include: deliver services faster by quickly finding information to answer user questions; reduce staff workload by drafting routine responses or code; handle complex tasks like summarizing large amounts of information; make information more accessible by improving readability of web pages and reports; do specialist tasks cheaper like summarizing technical documents or translating texts; streamline and automate service delivery; reduce demand on stretched public services; improve public satisfaction with services.,10/03/2025,,Centre for Digital Public Services Wales,wales.gov,Centre for Digital Public Services,13/02/2026,"The page provides guidance on understanding generative AI for public sector use, covering definition, benefits, and risks. It mentions popular Gen AI tools including: ChatGPT, Claude, Microsoft CoPilot, Google Gemini, Dall-E, and Midjourney. It also warns about risks including reliability issues, bias, privacy concerns, and intellectual property questions.",https://digitalpublicservices.gov.wales/guidance-and-standards/service-manual/using-artificial-intelligence-public-sector/understanding-generative-artificial-intelligence,live,Understanding generative artificial intelligence,Not AI
Not AI,No specific AI benefits described in this conversation as no document has been analyzed.,,,,,,18/02/2026,This appears to be a conversation clarification rather than an actual AI use case. The user noted that no document has been shared or analyzed yet.,Current conversation,planned,No tool discussed,Not AI
"Machine Learning, Other",Implementation of artificial intelligence in cancer treatment at Leeds Teaching Hospitals NHS Trust,15/11/2023,,Leeds Teaching Hospitals NHS Trust,leedsth.nhs.uk,,18/02/2026,Case studies of artificial intelligence applications in cancer treatment at Leeds Teaching Hospitals NHS Trust. The content details how AI is being used to improve cancer diagnostics and treatment pathways.,https://www.leedsth.nhs.uk/about/future/innovation/innovation-pop-up/case-studies-artificial-intelligence-in-cancer-treatment/,live,AI in Cancer Treatment,Health AI
"Machine Learning, Other","Consistent stakeholder engagement with average of 178 newsletter views per month; Programme growth with increased FutureNHS membership by 162; Successfully deployed infrastructure to support around 35 PCNs, with 30 now live; Supplied data for 11 PCNs with fully signed IG agreements; Improved understanding of digital clinical safety across 44 PCNs in the South West; Supported 22 PCNs in completing their Digital Clinical Safety Standard Operating Procedures (SOPs), leading to successful 'clinical go live'.",25/06/2025,,NHS England South West,scwcsu.nhs.uk,"NHS South, Central and West (NHS SCW)",18/02/2026,"The case study describes a successful implementation of Brave AI across multiple Primary Care Networks in the South West region, with 30 PCNs now live. The implementation was supported by NHS SCW through six key workstreams: Digital clinical safety, Hosting and infrastructure, Information Governance, Communications and engagement, Business analysis, and Human-centred design.",https://scwcsu.nhs.uk/case-studies/enabling-proactive-personalised-care-through-ai-multidisciplinary-support-from-nhs-scw,live,Brave AI,Predictive Analytics
"Natural Language Processing, generativeAI, Machine Learning","Reduces administrative time from hours to minutes (e.g., EHCPs from 4-5 hours to under 5 minutes), improves consistency in documentation, releases thousands of officer hours annually, enhances compliance across services, allows staff to progress cases more quickly, and enables officers to spend more time on high-value work with residents rather than paperwork.",27/11/2025,[email protected],Barking and Dagenham Council,local.gov.uk,Continuous Innovation Team,20/02/2026,"AI-powered web app that helps staff turn unstructured meeting transcripts, documents and reports into structured notes and formal plans in minutes. Published on Local Government Association website as a case study.",https://www.local.gov.uk/case-studies/barking-and-dagenham-council-bd-notes-house-developed-ai-app,live,BD Notes,Document Intelligence
